"Timestamp","1)  Fresnadillo has something serious to say about the ways in which extravagant chance can distort our perspective and throw us off the path of good sense .

2)  Everything its title implies , a standard-issue crime drama spat out from the Tinseltown assembly line .","1)  The uneven movie does have its charms and its funny moments but not quite enough of them .

2)  Delia , Greta , and Paula rank as three of the most multilayered and sympathetic female characters of the year .","1)  Delia , Greta , and Paula rank as three of the most multilayered and sympathetic female characters of the year .

2)  Insomnia is one of the year 's best films and Pacino gives one of his most daring , and complicated , performances .","1)  It pulls the rug out from under you , just when you 're ready to hate one character , or really sympathize with another character , something happens to send you off in different direction .

2)  Insomnia is one of the year 's best films and Pacino gives one of his most daring , and complicated , performances .","1)  Fresnadillo has something serious to say about the ways in which extravagant chance can distort our perspective and throw us off the path of good sense .

2)  I 've had more interesting -- and , dare I say , thematically complex -- bowel movements than this long-on-the-shelf , point-and-shoot exercise in gimmicky crime drama ","1)  Treasure Planet rivals the top Japanese animations of recent vintage .

2)  Everything its title implies , a standard-issue crime drama spat out from the Tinseltown assembly line .","1)  This painfully unfunny farce traffics in tired stereotypes and encumbers itself with complications ... that have no bearing on the story .

2)  A laughable -- or rather , unlaughable -- excuse for a film .","1)  a genre that 's already a joke in the United States .

2)  No , I don't know why Steven Seagal is considered a star , nor why he keeps being cast in action films when none of them are ever any good or make any money .","1)  Opening with some contrived banter , cliches and some loose ends , the screenplay only comes into its own in the second half .

2)  Standing in the Shadows of Motown is the best kind of documentary , one that makes a depleted yesterday feel very much like a brand-new tomorrow .","1)  This painfully unfunny farce traffics in tired stereotypes and encumbers itself with complications ... that have no bearing on the story .

2)  It is messy , uncouth , incomprehensible , vicious and absurd .","1)  More good than great but Freeman and Judd make it work .

2)  Romantic , riveting and handsomely animated .","1)  My precious new Star Wars movie is a lumbering , wheezy drag ...

2)  Everything its title implies , a standard-issue crime drama spat out from the Tinseltown assembly line .","1)  It pulls the rug out from under you , just when you 're ready to hate one character , or really sympathize with another character , something happens to send you off in different direction .

2)  A somewhat disappointing and meandering saga .","1)  Provides a satisfactory overview of the bizarre world of extreme athletes as several daredevils express their own views .

2)  New ways of describing badness need to be invented to describe exactly how bad it is .","1)  A laughable -- or rather , unlaughable -- excuse for a film .

2)  It makes sense that he went back to school to check out the girls -- his film is a frat boy 's idea of a good time .","1)  The main characters are simply named The Husband , The Wife and The Kidnapper , emphasizing the disappointingly generic nature of the entire effort .

2)  If you adored The Full Monty so resoundingly that you 're dying to see the same old thing in a tired old setting , then this should keep you reasonably entertained .","1)  Even when it drags , we are forced to reflect that its visual imagination is breathtaking

2)  Occasionally loud and offensive , but more often , it simply lulls you into a gentle waking coma .","1)  Fresnadillo has something serious to say about the ways in which extravagant chance can distort our perspective and throw us off the path of good sense .

2)  This movie ... doesn't deserve the energy it takes to describe how bad it is .","1)  This painfully unfunny farce traffics in tired stereotypes and encumbers itself with complications ... that have no bearing on the story .

2)  This movie ... doesn't deserve the energy it takes to describe how bad it is .","1)  Delia , Greta , and Paula rank as three of the most multilayered and sympathetic female characters of the year .

2)  An emotionally strong and politically potent piece of cinema .","1)  A brilliant , absurd collection of vignettes that , in their own idiosyncratic way , sum up the strange horror of life in the new millennium .

2)  My precious new Star Wars movie is a lumbering , wheezy drag ...","1)  Provides a satisfactory overview of the bizarre world of extreme athletes as several daredevils express their own views .

2)  The respective charms of Sandra Bullock and Hugh Grant have worn threadbare .","1)  This painfully unfunny farce traffics in tired stereotypes and encumbers itself with complications ... that have no bearing on the story .

2)  A positively thrilling combination of ethnography and all the intrigue , betrayal , deceit and murder of a Shakespearean tragedy or a juicy soap opera .","1)  A positively thrilling combination of ethnography and all the intrigue , betrayal , deceit and murder of a Shakespearean tragedy or a juicy soap opera .

2)  I 've had more interesting -- and , dare I say , thematically complex -- bowel movements than this long-on-the-shelf , point-and-shoot exercise in gimmicky crime drama ","1)  Even when it drags , we are forced to reflect that its visual imagination is breathtaking

2)  Provides a satisfactory overview of the bizarre world of extreme athletes as several daredevils express their own views .","1)  Even when it drags , we are forced to reflect that its visual imagination is breathtaking

2)  I 've had more interesting -- and , dare I say , thematically complex -- bowel movements than this long-on-the-shelf , point-and-shoot exercise in gimmicky crime drama ","1)  The uneven movie does have its charms and its funny moments but not quite enough of them .

2)  Will probably be one of those movies barely registering a blip on the radar screen of 2002 .","1)  The respective charms of Sandra Bullock and Hugh Grant have worn threadbare .

2)  Narratively , Trouble Every Day is a plodding mess .","1)  Provides a satisfactory overview of the bizarre world of extreme athletes as several daredevils express their own views .

2)  Standing in the Shadows of Motown is the best kind of documentary , one that makes a depleted yesterday feel very much like a brand-new tomorrow .","1)  a genre that 's already a joke in the United States .

2)  I admire the closing scenes of the film , which seem to ask whether our civilization offers a cure for Vincent 's complaint ."
"2020/07/07 9:35:53 AM GMT+5:30","3","2","1","7","9","2","7","7","3","8","3","2","6","4","2","4","4","4","8","7","5","3","1","4","5","6","7","4","2","4"