"Timestamp","1)  Simply put , there should have been a more compelling excuse to pair Susan Sarandon and Goldie Hawn .

2)  A brilliant , absurd collection of vignettes that , in their own idiosyncratic way , sum up the strange horror of life in the new millennium .","1)  Washington as possibly the best actor working in movies today

2)  Opening with some contrived banter , cliches and some loose ends , the screenplay only comes into its own in the second half .","1)  There 's little to recommend Snow Dogs , unless one considers cliched dialogue and perverse escapism a source of high hilarity .

2)  The film does n't really care about the thousands of Americans who die hideously , it cares about how Ryan meets his future wife and makes his start at the CIA .","1)  A brilliant , absurd collection of vignettes that , in their own idiosyncratic way , sum up the strange horror of life in the new millennium .

2)  While this has the making of melodrama , the filmmaker cuts against this natural grain , producing a work that 's more interested in asking questions than in answering them .","1)  More good than great but Freeman and Judd make it work .

2)  It makes sense that he went back to school to check out the girls -- his film is a frat boy 's idea of a good time .","1)  Even fans of Ismail Merchant 's work , I suspect , would have a hard time sitting through this one .

2)  Will probably be one of those movies barely registering a blip on the radar screen of 2002 .","1)  I 've had more interesting -- and , dare I say , thematically complex -- bowel movements than this long-on-the-shelf , point-and-shoot exercise in gimmicky crime drama 

2)  Will probably be one of those movies barely registering a blip on the radar screen of 2002 .","1)  I admire the closing scenes of the film , which seem to ask whether our civilization offers a cure for Vincent 's complaint .

2)  My precious new Star Wars movie is a lumbering , wheezy drag ...","1)  It is most remarkable not because of its epic scope , but because of the startling intimacy it achieves despite that breadth .

2)  The main characters are simply named The Husband , The Wife and The Kidnapper , emphasizing the disappointingly generic nature of the entire effort .","1)  Fresnadillo has something serious to say about the ways in which extravagant chance can distort our perspective and throw us off the path of good sense .

2)  More good than great but Freeman and Judd make it work .","1)  Sometimes there are very , very good reasons for certain movies to be sealed in a jar and left on a remote shelf indefinitely .

2)  I admire the closing scenes of the film , which seem to ask whether our civilization offers a cure for Vincent 's complaint .","1)  A brilliant , absurd collection of vignettes that , in their own idiosyncratic way , sum up the strange horror of life in the new millennium .

2)  The respective charms of Sandra Bullock and Hugh Grant have worn threadbare .","1)  Sometimes there are very , very good reasons for certain movies to be sealed in a jar and left on a remote shelf indefinitely .

2)  Even when it drags , we are forced to reflect that its visual imagination is breathtaking","1)  Sometimes there are very , very good reasons for certain movies to be sealed in a jar and left on a remote shelf indefinitely .

2)  It is messy , uncouth , incomprehensible , vicious and absurd .","1)  Insomnia is one of the year 's best films and Pacino gives one of his most daring , and complicated , performances .

2)  It makes sense that he went back to school to check out the girls -- his film is a frat boy 's idea of a good time .","1)  Simply put , there should have been a more compelling excuse to pair Susan Sarandon and Goldie Hawn .

2)  My precious new Star Wars movie is a lumbering , wheezy drag ...","1)  The uneven movie does have its charms and its funny moments but not quite enough of them .

2)  Kwan is a master of shadow , quietude , and room noise , and Lan Yu is a disarmingly lived-in movie .","1)  Washington as possibly the best actor working in movies today

2)  Insomnia is one of the year 's best films and Pacino gives one of his most daring , and complicated , performances .","1)  It pulls the rug out from under you , just when you 're ready to hate one character , or really sympathize with another character , something happens to send you off in different direction .

2)  The uneven movie does have its charms and its funny moments but not quite enough of them .","1)  There 's little to recommend Snow Dogs , unless one considers cliched dialogue and perverse escapism a source of high hilarity .

2)  Fresnadillo has something serious to say about the ways in which extravagant chance can distort our perspective and throw us off the path of good sense .","1)  Even when it drags , we are forced to reflect that its visual imagination is breathtaking

2)  Treasure Planet rivals the top Japanese animations of recent vintage .","1)  Opening with some contrived banter , cliches and some loose ends , the screenplay only comes into its own in the second half .

2)  Simply put , there should have been a more compelling excuse to pair Susan Sarandon and Goldie Hawn .","1)  A brilliant , absurd collection of vignettes that , in their own idiosyncratic way , sum up the strange horror of life in the new millennium .

2)  Delia , Greta , and Paula rank as three of the most multilayered and sympathetic female characters of the year .","1)  Dripping with cliche and bypassing no opportunity to trivialize the material .

2)  Everything its title implies , a standard-issue crime drama spat out from the Tinseltown assembly line .","1)  Treasure Planet rivals the top Japanese animations of recent vintage .

2)  It 's consistently funny , in an irresistible junior-high way , and consistently free of any gag that would force you to give it a millisecond of thought .","1)  The main characters are simply named The Husband , The Wife and The Kidnapper , emphasizing the disappointingly generic nature of the entire effort .

2)  The respective charms of Sandra Bullock and Hugh Grant have worn threadbare .","1)  New ways of describing badness need to be invented to describe exactly how bad it is .

2)  The film 's constant mood of melancholy and its unhurried narrative are masterfully controlled .","1)  Treasure Planet rivals the top Japanese animations of recent vintage .

2)  A laughable -- or rather , unlaughable -- excuse for a film .","1)  The whole affair is as predictable as can be .

2)  The respective charms of Sandra Bullock and Hugh Grant have worn threadbare .","1)  The respective charms of Sandra Bullock and Hugh Grant have worn threadbare .

2)  It 's consistently funny , in an irresistible junior-high way , and consistently free of any gag that would force you to give it a millisecond of thought ."
"2020/06/29 11:12:35 PM GMT+5:30","4","4","8","6","8","9","10","3","3","7","2","8","3","10","7","8","7","10","4","2","9","10","10","9","9","1","2","1","3","8"
"2020/07/05 2:36:50 PM GMT+5:30","2","3","8","9","7","8","6","7","4","7","9","7","7","2","7","6","6","9","6","6","9","8","9","9","7","7","2","2","8","9"