"Timestamp","1)  Sometimes there are very , very good reasons for certain movies to be sealed in a jar and left on a remote shelf indefinitely .

2)  Provides a satisfactory overview of the bizarre world of extreme athletes as several daredevils express their own views .","1)  No , I don't know why Steven Seagal is considered a star , nor why he keeps being cast in action films when none of them are ever any good or make any money .

2)  I admire the closing scenes of the film , which seem to ask whether our civilization offers a cure for Vincent 's complaint .","1)  A positively thrilling combination of ethnography and all the intrigue , betrayal , deceit and murder of a Shakespearean tragedy or a juicy soap opera .

2)  Narratively , Trouble Every Day is a plodding mess .","1)  It is most remarkable not because of its epic scope , but because of the startling intimacy it achieves despite that breadth .

2)  It 's consistently funny , in an irresistible junior-high way , and consistently free of any gag that would force you to give it a millisecond of thought .","1)  Opening with some contrived banter , cliches and some loose ends , the screenplay only comes into its own in the second half .

2)  It is most remarkable not because of its epic scope , but because of the startling intimacy it achieves despite that breadth .","1)  The main characters are simply named The Husband , The Wife and The Kidnapper , emphasizing the disappointingly generic nature of the entire effort .

2)  Will probably be one of those movies barely registering a blip on the radar screen of 2002 .","1)  Simply put , there should have been a more compelling excuse to pair Susan Sarandon and Goldie Hawn .

2)  This movie ... doesn't deserve the energy it takes to describe how bad it is .","1)  Dripping with cliche and bypassing no opportunity to trivialize the material .

2)  A visual spectacle full of stunning images and effects .","1)  It pulls the rug out from under you , just when you 're ready to hate one character , or really sympathize with another character , something happens to send you off in different direction .

2)  Dripping with cliche and bypassing no opportunity to trivialize the material .","1)  Insomnia is one of the year 's best films and Pacino gives one of his most daring , and complicated , performances .

2)  An emotionally strong and politically potent piece of cinema .","1)  Provides a satisfactory overview of the bizarre world of extreme athletes as several daredevils express their own views .

2)  Will probably be one of those movies barely registering a blip on the radar screen of 2002 .","1)  The respective charms of Sandra Bullock and Hugh Grant have worn threadbare .

2)  Punch-Drunk Love is so convinced of its own brilliance that , if it were a person , you 'd want to smash its face in.","1)  It pulls the rug out from under you , just when you 're ready to hate one character , or really sympathize with another character , something happens to send you off in different direction .

2)  Punch-Drunk Love is so convinced of its own brilliance that , if it were a person , you 'd want to smash its face in.","1)  There 's little to recommend Snow Dogs , unless one considers cliched dialogue and perverse escapism a source of high hilarity .

2)  Everything its title implies , a standard-issue crime drama spat out from the Tinseltown assembly line .","1)  The respective charms of Sandra Bullock and Hugh Grant have worn threadbare .

2)  Everything its title implies , a standard-issue crime drama spat out from the Tinseltown assembly line .","1)  Simply put , there should have been a more compelling excuse to pair Susan Sarandon and Goldie Hawn .

2)  While this has the making of melodrama , the filmmaker cuts against this natural grain , producing a work that 's more interested in asking questions than in answering them .","1)  Sometimes there are very , very good reasons for certain movies to be sealed in a jar and left on a remote shelf indefinitely .

2)  The whole affair is as predictable as can be .","1)  Romantic , riveting and handsomely animated .

2)  Will probably be one of those movies barely registering a blip on the radar screen of 2002 .","1)  The main characters are simply named The Husband , The Wife and The Kidnapper , emphasizing the disappointingly generic nature of the entire effort .

2)  It is messy , uncouth , incomprehensible , vicious and absurd .","1)  It is most remarkable not because of its epic scope , but because of the startling intimacy it achieves despite that breadth .

2)  It pulls the rug out from under you , just when you 're ready to hate one character , or really sympathize with another character , something happens to send you off in different direction .","1)  There 's little to recommend Snow Dogs , unless one considers cliched dialogue and perverse escapism a source of high hilarity .

2)  The main characters are simply named The Husband , The Wife and The Kidnapper , emphasizing the disappointingly generic nature of the entire effort .","1)  Provides a satisfactory overview of the bizarre world of extreme athletes as several daredevils express their own views .

2)  It pulls the rug out from under you , just when you 're ready to hate one character , or really sympathize with another character , something happens to send you off in different direction .","1)  The film does n't really care about the thousands of Americans who die hideously , it cares about how Ryan meets his future wife and makes his start at the CIA .

2)  It makes sense that he went back to school to check out the girls -- his film is a frat boy 's idea of a good time .","1)  Opening with some contrived banter , cliches and some loose ends , the screenplay only comes into its own in the second half .

2)  A brilliant , absurd collection of vignettes that , in their own idiosyncratic way , sum up the strange horror of life in the new millennium .","1)  The film 's constant mood of melancholy and its unhurried narrative are masterfully controlled .

2)  A somewhat disappointing and meandering saga .","1)  Even fans of Ismail Merchant 's work , I suspect , would have a hard time sitting through this one .

2)  The main characters are simply named The Husband , The Wife and The Kidnapper , emphasizing the disappointingly generic nature of the entire effort .","1)  Treasure Planet rivals the top Japanese animations of recent vintage .

2)  Romantic , riveting and handsomely animated .","1)  While this has the making of melodrama , the filmmaker cuts against this natural grain , producing a work that 's more interested in asking questions than in answering them .

2)  I 've had more interesting -- and , dare I say , thematically complex -- bowel movements than this long-on-the-shelf , point-and-shoot exercise in gimmicky crime drama ","1)  A welcome relief from baseball movies that try too hard to be mythic , this one is a sweet and modest and ultimately winning story .

2)  It makes sense that he went back to school to check out the girls -- his film is a frat boy 's idea of a good time .","1)  Kwan is a master of shadow , quietude , and room noise , and Lan Yu is a disarmingly lived-in movie .

2)  Insomnia is one of the year 's best films and Pacino gives one of his most daring , and complicated , performances ."
"2020/08/02 9:24:51 AM GMT+5:30","2","1","8","3","4","2","8","2","4","10","7","6","3","7","8","7","9","10","6","8","6","4","2","4","2","7","8","6","3","2"
"2020/08/02 2:03:00 PM GMT+5:30","2","1","8","3","4","2","8","2","4","10","7","6","3","7","8","7","9","10","6","8","6","4","2","4","2","7","8","6","3","2"