"Timestamp","1)  More good than great but Freeman and Judd make it work .

2)  The film 's constant mood of melancholy and its unhurried narrative are masterfully controlled .","1)  Kwan is a master of shadow , quietude , and room noise , and Lan Yu is a disarmingly lived-in movie .

2)  It makes sense that he went back to school to check out the girls -- his film is a frat boy 's idea of a good time .","1)  a genre that 's already a joke in the United States .

2)  Simply put , there should have been a more compelling excuse to pair Susan Sarandon and Goldie Hawn .","1)  More good than great but Freeman and Judd make it work .

2)  A laughable -- or rather , unlaughable -- excuse for a film .","1)  Dripping with cliche and bypassing no opportunity to trivialize the material .

2)  A laughable -- or rather , unlaughable -- excuse for a film .","1)  Even when it drags , we are forced to reflect that its visual imagination is breathtaking

2)  More good than great but Freeman and Judd make it work .","1)  Even fans of Ismail Merchant 's work , I suspect , would have a hard time sitting through this one .

2)  A somewhat disappointing and meandering saga .","1)  Occasionally loud and offensive , but more often , it simply lulls you into a gentle waking coma .

2)  A visual spectacle full of stunning images and effects .","1)  The whole affair is as predictable as can be .

2)  The main characters are simply named The Husband , The Wife and The Kidnapper , emphasizing the disappointingly generic nature of the entire effort .","1)  Even when it drags , we are forced to reflect that its visual imagination is breathtaking

2)  An emotionally strong and politically potent piece of cinema .","1)  Narratively , Trouble Every Day is a plodding mess .

2)  Standing in the Shadows of Motown is the best kind of documentary , one that makes a depleted yesterday feel very much like a brand-new tomorrow .","1)  This painfully unfunny farce traffics in tired stereotypes and encumbers itself with complications ... that have no bearing on the story .

2)  Provides a satisfactory overview of the bizarre world of extreme athletes as several daredevils express their own views .","1)  Romantic , riveting and handsomely animated .

2)  It 's consistently funny , in an irresistible junior-high way , and consistently free of any gag that would force you to give it a millisecond of thought .","1)  Even when it drags , we are forced to reflect that its visual imagination is breathtaking

2)  A positively thrilling combination of ethnography and all the intrigue , betrayal , deceit and murder of a Shakespearean tragedy or a juicy soap opera .","1)  I 've had more interesting -- and , dare I say , thematically complex -- bowel movements than this long-on-the-shelf , point-and-shoot exercise in gimmicky crime drama 

2)  Standing in the Shadows of Motown is the best kind of documentary , one that makes a depleted yesterday feel very much like a brand-new tomorrow .","1)  This painfully unfunny farce traffics in tired stereotypes and encumbers itself with complications ... that have no bearing on the story .

2)  Delia , Greta , and Paula rank as three of the most multilayered and sympathetic female characters of the year .","1)  A brilliant , absurd collection of vignettes that , in their own idiosyncratic way , sum up the strange horror of life in the new millennium .

2)  Everything its title implies , a standard-issue crime drama spat out from the Tinseltown assembly line .","1)  There 's little to recommend Snow Dogs , unless one considers cliched dialogue and perverse escapism a source of high hilarity .

2)  Will probably be one of those movies barely registering a blip on the radar screen of 2002 .","1)  Opening with some contrived banter , cliches and some loose ends , the screenplay only comes into its own in the second half .

2)  The film 's constant mood of melancholy and its unhurried narrative are masterfully controlled .","1)  A welcome relief from baseball movies that try too hard to be mythic , this one is a sweet and modest and ultimately winning story .

2)  Fresnadillo has something serious to say about the ways in which extravagant chance can distort our perspective and throw us off the path of good sense .","1)  It is most remarkable not because of its epic scope , but because of the startling intimacy it achieves despite that breadth .

2)  It makes sense that he went back to school to check out the girls -- his film is a frat boy 's idea of a good time .","1)  Washington as possibly the best actor working in movies today

2)  A positively thrilling combination of ethnography and all the intrigue , betrayal , deceit and murder of a Shakespearean tragedy or a juicy soap opera .","1)  Delia , Greta , and Paula rank as three of the most multilayered and sympathetic female characters of the year .

2)  A somewhat disappointing and meandering saga .","1)  Even fans of Ismail Merchant 's work , I suspect , would have a hard time sitting through this one .

2)  It 's consistently funny , in an irresistible junior-high way , and consistently free of any gag that would force you to give it a millisecond of thought .","1)  a genre that 's already a joke in the United States .

2)  I 've had more interesting -- and , dare I say , thematically complex -- bowel movements than this long-on-the-shelf , point-and-shoot exercise in gimmicky crime drama ","1)  This painfully unfunny farce traffics in tired stereotypes and encumbers itself with complications ... that have no bearing on the story .

2)  A brilliant , absurd collection of vignettes that , in their own idiosyncratic way , sum up the strange horror of life in the new millennium .","1)  There 's little to recommend Snow Dogs , unless one considers cliched dialogue and perverse escapism a source of high hilarity .

2)  It pulls the rug out from under you , just when you 're ready to hate one character , or really sympathize with another character , something happens to send you off in different direction .","1)  An emotionally strong and politically potent piece of cinema .

2)  A laughable -- or rather , unlaughable -- excuse for a film .","1)  a genre that 's already a joke in the United States .

2)  Treasure Planet rivals the top Japanese animations of recent vintage .","1)  The main characters are simply named The Husband , The Wife and The Kidnapper , emphasizing the disappointingly generic nature of the entire effort .

2)  While this has the making of melodrama , the filmmaker cuts against this natural grain , producing a work that 's more interested in asking questions than in answering them ."
"2020/07/04 12:12:43 PM GMT+5:30","6","1","7","4","8","7","8","5","8","9","2","4","6","8","2","2","1","9","6","8","2","10","3","6","10","3","1","1","1","2"
"2020/07/11 9:05:12 PM GMT+5:30","6","3","8","2","8","6","8","2","8","6","3","2","7","6","3","1","2","9","2","5","3","6","3","4","8","3","2","1","4","4"